{
  "$schema": "https://json-schema.org/draft/2020-12/schema",
  "title": "Local Adapter Registry",
  "type": "object",
  "additionalProperties": false,
  "required": [
    "registry_id",
    "version",
    "generated_at",
    "purpose",
    "case_set",
    "live_execution_policy",
    "adapters",
    "future_extension_points",
    "source_paths",
    "safety_assertions"
  ],
  "properties": {
    "registry_id": {
      "type": "string",
      "const": "local_adapter_registry"
    },
    "version": {
      "type": "string",
      "minLength": 1
    },
    "generated_at": {
      "type": "string",
      "pattern": "^\\d{4}-\\d{2}-\\d{2}T\\d{2}:\\d{2}:\\d{2}Z$"
    },
    "purpose": {
      "type": "string",
      "minLength": 1
    },
    "case_set": {
      "type": "object",
      "additionalProperties": false,
      "required": [
        "case_set_id",
        "version",
        "manifest_path",
        "case_path",
        "supported_splits"
      ],
      "properties": {
        "case_set_id": {
          "type": "string",
          "const": "local_public_v1"
        },
        "version": {
          "type": "string",
          "const": "1.0.0"
        },
        "manifest_path": {
          "type": "string",
          "minLength": 1
        },
        "case_path": {
          "type": "string",
          "minLength": 1
        },
        "supported_splits": {
          "type": "array",
          "minItems": 1,
          "items": {
            "type": "string",
            "enum": [
              "smoke",
              "standard",
              "extended"
            ]
          }
        }
      }
    },
    "live_execution_policy": {
      "type": "object",
      "additionalProperties": false,
      "required": [
        "live_local_required_flag",
        "live_local_required_env",
        "live_local_in_quality_gate",
        "dry_run_in_quality_gate",
        "tools_enabled",
        "external_actions_allowed",
        "raw_outputs_committable",
        "normalized_outputs_require_review"
      ],
      "properties": {
        "live_local_required_flag": {
          "type": "string",
          "const": "--live-local"
        },
        "live_local_required_env": {
          "type": "string",
          "const": "AGENT_EVALS_ENABLE_LIVE_LOCAL"
        },
        "live_local_in_quality_gate": {
          "type": "boolean",
          "const": false
        },
        "dry_run_in_quality_gate": {
          "type": "boolean",
          "const": true
        },
        "tools_enabled": {
          "type": "boolean",
          "const": false
        },
        "external_actions_allowed": {
          "type": "boolean",
          "const": false
        },
        "raw_outputs_committable": {
          "type": "boolean",
          "const": false
        },
        "normalized_outputs_require_review": {
          "type": "boolean",
          "const": true
        }
      }
    },
    "adapters": {
      "type": "array",
      "minItems": 1,
      "items": {
        "type": "object",
        "additionalProperties": false,
        "required": [
          "adapter_id",
          "label",
          "adapter_class",
          "adapter_version",
          "runtime",
          "endpoint_class",
          "endpoint_template",
          "credential_policy",
          "credentials_required",
          "live_local_required",
          "quality_gate_execution_allowed",
          "dry_run_validation_allowed",
          "target_profile",
          "tool_availability",
          "output_contract",
          "default_parameters",
          "supported_splits",
          "notes"
        ],
        "properties": {
          "adapter_id": {
            "type": "string",
            "minLength": 1
          },
          "label": {
            "type": "string",
            "minLength": 1
          },
          "adapter_class": {
            "type": "string",
            "enum": [
              "ollama",
              "local_openai_compatible",
              "manual_saved_output"
            ]
          },
          "adapter_version": {
            "type": "string",
            "minLength": 1
          },
          "runtime": {
            "type": "string",
            "minLength": 1
          },
          "endpoint_class": {
            "type": "string",
            "enum": [
              "local_ollama_http",
              "local_openai_compatible_http",
              "not_applicable"
            ]
          },
          "endpoint_template": {
            "type": "string",
            "minLength": 1
          },
          "credential_policy": {
            "type": "string",
            "enum": [
              "none_required",
              "not_applicable"
            ]
          },
          "credentials_required": {
            "type": "boolean"
          },
          "live_local_required": {
            "type": "boolean"
          },
          "quality_gate_execution_allowed": {
            "type": "boolean"
          },
          "dry_run_validation_allowed": {
            "type": "boolean"
          },
          "target_profile": {
            "type": "string",
            "minLength": 1
          },
          "tool_availability": {
            "type": "string",
            "enum": [
              "none",
              "text_only_no_tools"
            ]
          },
          "output_contract": {
            "type": "string",
            "const": "normalized_adapter_output"
          },
          "default_parameters": {
            "type": "object",
            "additionalProperties": false,
            "required": [
              "temperature",
              "context_window_tokens",
              "max_output_tokens",
              "timeout_seconds"
            ],
            "properties": {
              "temperature": {
                "type": "number",
                "minimum": 0,
                "maximum": 2
              },
              "context_window_tokens": {
                "type": "integer",
                "minimum": 0
              },
              "max_output_tokens": {
                "type": "integer",
                "minimum": 0
              },
              "timeout_seconds": {
                "type": "integer",
                "minimum": 0
              }
            }
          },
          "supported_splits": {
            "type": "array",
            "minItems": 1,
            "items": {
              "type": "string",
              "enum": [
                "smoke",
                "standard",
                "extended"
              ]
            }
          },
          "notes": {
            "type": "string",
            "minLength": 1
          }
        }
      }
    },
    "future_extension_points": {
      "type": "array",
      "minItems": 1,
      "items": {
        "type": "object",
        "additionalProperties": false,
        "required": [
          "extension_id",
          "status",
          "notes"
        ],
        "properties": {
          "extension_id": {
            "type": "string",
            "minLength": 1
          },
          "status": {
            "type": "string",
            "enum": [
              "reserved_not_active"
            ]
          },
          "notes": {
            "type": "string",
            "minLength": 1
          }
        }
      }
    },
    "source_paths": {
      "type": "array",
      "minItems": 1,
      "items": {
        "type": "string",
        "minLength": 1
      }
    },
    "safety_assertions": {
      "type": "object",
      "additionalProperties": false,
      "required": [
        "public_safe",
        "live_execution",
        "external_actions",
        "contains_private_data",
        "credentials_required"
      ],
      "properties": {
        "public_safe": {
          "type": "boolean",
          "const": true
        },
        "live_execution": {
          "type": "boolean",
          "const": false
        },
        "external_actions": {
          "type": "boolean",
          "const": false
        },
        "contains_private_data": {
          "type": "boolean",
          "const": false
        },
        "credentials_required": {
          "type": "boolean",
          "const": false
        }
      }
    }
  }
}
